{
  "id": "twist",
  "title": "Plot twist",
  "fields": {
    "beat": "Twist",
    "on_screen_text": "plot twist: she took my pillow",
    "camera": "Overhead",
    "transition": "Hand cover",
    "sound": "Record scratch"
  },
  "variants": [
    {
      "id": "overhead",
      "name": "Overhead",
      "type": "image",
      "asset": "cat-05-pillow"
    },
    {
      "type": "canvas",
      "name": "Reaction",
      "layers": [
        {
          "id": "main",
          "asset": "cat-05-pillow",
          "x": 0,
          "y": 0,
          "width": 1080,
          "height": 1920,
          "slot": {
            "x": 0,
            "y": 0,
            "width": 1080,
            "height": 1920,
            "name": "Main"
          }
        },
        {
          "id": "inset",
          "asset": "cat-04-stare",
          "x": 604.8,
          "y": 249.6,
          "width": 410.4,
          "height": 547.2,
          "crop": {
            "x": 0,
            "y": 160,
            "width": 720,
            "height": 960
          },
          "slot": {
            "x": 604.8,
            "y": 249.6,
            "width": 410.4,
            "height": 547.2,
            "name": "Inset"
          }
        },
        {
          "kind": "text",
          "x": 86.4,
          "y": 1228.8,
          "width": 907.2,
          "style": "bold",
          "stroke": {
            "color": "#000000",
            "width": 7
          },
          "shadow": {
            "color": "rgba(0,0,0,0.55)",
            "blur": 13,
            "offset_x": 0,
            "offset_y": 4
          },
          "font": "Montserrat",
          "font_weight": 800,
          "font_size": 73,
          "color": "#ffffff",
          "align": "center",
          "line_height": 1.15,
          "text": "plot twist: she took my pillow",
          "id": "twist-caption"
        }
      ],
      "id": "v_96xub1"
    }
  ],
  "active_variant": "v_96xub1"
}
